<!ELEMENT palinsesto (cartellone+)>
        <!ELEMENT cartellone (percorso, folder, durata)>
        <!ELEMENT percorso (#PCDATA)>
        <!ELEMENT folder (#PCDATA)>
        <!ELEMENT durata (#PCDATA)>