<?xml version="1.0" encoding="UTF-8"?>
<!-- Decommenta per usare dtd
<!DOCTYPE palinsesto SYSTEM "palinsesto.dtd">
<palinsesto>-->
<palinsesto xmlns:xsi="http://www.w3.org/2001/XMLSchema-instance"
            xsi:noNamespaceSchemaLocation="palinsesto.xsd">
    <cartellone>
        <percorso>cartelloni/lidl/lidl.html</percorso>
        <folder>lidl</folder>
        <durata>10</durata>
    </cartellone>
    <cartellone>
        <percorso>cartelloni/omega/omega.html</percorso>
        <folder>omega</folder>
        <durata>10</durata>
    </cartellone>
    <cartellone>
        <percorso>cartelloni/arcteryx/arcteryx.html</percorso>
        <folder>arcteryx</folder>
        <durata>10</durata>
    </cartellone>
</palinsesto>